B100000_v02.txt_2.txt	나의 취미	나의 취미는 요리하고 음막을 들을 것이 있다. 나는 맛있을 음시가 좋아하니까 요리가 좋아하다. 내가 요리할술 잘아다. 친구하고 가주들이 내가 만든 음식이 좋아하다. 그래서 나는 시간이 있으면 나주 요리하다. 요리할 때 기분이 다라서 요리하는 음식이 다라다. 그 취미 생활을 할 때 준비해야 할 것이 많지 만다. 요리전에 제류가 준비해야 되다. 그러서 어머니가 나게 야책하고 고기를 안 것을 가르쳐주시다. 나는 한국에 오후에 자주 요리하다. 하지만 제류가다라서 음식이 다나다. 나는 한국 음식을 배우고 싶다. 고향에 돌아가는때 가주에게 요리하다. 요리는 내가 기분이 좋때 취미있다. 내가 기분이 나빠는때 음악을 들은 것 좋아하다. 기분이 나빠는 때 음막이 듣고 기분이 변화하다. 나는 음막이 들은 것 좋아하지만 노래를 부리수 없다. 내가 중국 음막이 자주 듣다. 하지만 내가 좋아하는 가주가 없다. 취미 생활은 좋아하다.	B1
B100284_v01.txt_2.txt	나의 취미	나의 취미는 초등학교때 시작한 지 7년 된 럭비이다. 옛날에 공부하면 스트레스를 받았기 때문에 럭비를 하면 스트레스 많이 푸었다. 홍콩에서 럭비하는 것이 유명하지 않지만 초등학교때 럭비 수업이 있었으니까 한번 해서 발로 반했다. 그리고 쉬는 시간에 친구와 같이 럭비를 하고 동료회가 참가해서 일주일에 두 번 연습을 하고 경기도 했다. 럭비를 할 때 사람을 꼭 맞으니까 준비하는 것이 있어도 다칠 수 있는데 아픈감은 감소할 수 있었다. 나는 럭비를 연습할 때도 많이 다쳤기 때문에 주의하는 점이 있다. 럭비 하면 사람을 맞은 후에 머리를 꼭 보호하고 다리를 다치지 않는 게 움직하면 안 된다. 그리고 주위 사람들이 조심했다. 다른 사람이 나한테 맞으면 콧피가 쉽게 났기 때문 다. 마지막으로 럭비하기 전에 준비운동을 해야한다. 준비운동을 하면 쉽게 다칠 수 없었다. 럭비를 하면 다친 일이 많고 지금도 그만구지만 다시 럭비를 했으면 옛날 기억이 나고 기분이 더 좋아진다고 생각한다.	B1
B100167_v02.txt_2.txt	나의 취미	내가 좋아하는 취미는 영화감상이다. 영화감상은 재미있기 때문에 내가 스트레스를 받을 때 항상 하는 활동이다. 내 아버지께서 영화감상에 대해 매우 좋아하신다. 그래서 나는 어렸을 때 아버지와 자주 영화를 보기 때문에 나도 영화감상을 좋아하게 됐다. 나는 홍콩에서 살 때 영화관에 일주일 한번 간다. 하지만 한국에 온 후에 한국 영화에 대해 이해하지 못해서 세번밖에 못 간다. 요즘 집에서 컴퓨터로 홍콩 영화나 다른 영화를 자주 본다. 영화감상의 준비해야 할 것이 아주 걱다. 보통 돈고 시간만 필요하다. 하지만 돈을 쓰기 않으면 텔레비전으로 무료 영화를 볼 수 있다. 그리고 DVD를 빌리면 많은 돈이 필요하지 않다. 영화감상이 스트레스를 푸는 데 도움이 많이 된다. 스트레스를 받르 때 코미영화나 슬픈 영화를 보는 것이 아주 좋다. 많이 울거나 웃은 후에 기분이 좋아진다. 나는 10살 때부터 영화감상을 시작했지만 대부분 시간은 홍콩 영화만 본다. 그래서 미래에 다른 나라 여오하를 만힝 보면 좋겠다. 지금까지 내가 좋아하는 취미에 대해 소개하였다. 심심하면 영화를 한번 보는 것이 좋다.	B1
B100097_v02.txt_2.txt	나의 취미	나의 취미는 노래듣기 이다. 어렸을 때 부터 노래를 좋아한다. 아기였을 때 많이 들었다. 하지만 노래를 들으면 눈물이 근방 없어졌이다. 그때가 알았다. 내가 노래를 좋아한다. 그래서 그때 부터 지금까지 항상 노래를 든다. 나의 하루의 시직이 노래이다. 일어나기 힘들때 신나는 노래를 들으면 기분이도 좋아진다. 좋은 기분으로 좋은 하루를 보낼 수 있다. 그리고 자기 전에는 좀 조영한 노래를 들으면 근방 잠이 오고 잘 잘수 있다. 그래서 항상 노래로 기분전환을 한다. 살면서 우울할 때 있으면 노래를 든다. 노래중에서 가사 좋은 노래가 많이 있어서 그 가사를 든면 기분도 좋아진다. 기억속에서 제일 인성족인 일이있다. 대학교 다녔을 때 많이 힘들었었다. 처음에 부모님께서 떠나고 아는사람도 하나도 없어의 다른 도시에 갔다. 그때 유이한 익속한 일이는 노래였다. 그 동안 하루하루은 노래를 들으면서 지냈다. 한 노래의 이름이 You rise me up이다. 그 때가 이 노래은 정말 힘이 많이 준다. 그래서 지금도 이 노래를 들으면 힘이 생긴다. 노래듣기는 다른 취미 보다 좋은 점이 음악 만 있으면 되다. 가사 없어도 괜찮다. 메로디가 있으면 노래가 될 수 있다. 노래는 정말 나에게 많이 힘이 주고 희망도 많이 준다. 그래서 앞으로 기회가 되면 직접 노재를 만들고 싶다. 노래 이 취미는 나중에도 계속 할 것이다.	B1
B100324_v01.txt_2.txt	나의 취미	여러가지 취미 중에 내가 제일 좋아하는 취미는 사진 직는 것이다. 사진 직기를 시작한지 5년이 되었다. 대학교 다녔을 때 방학마다 친구를 같이 놀러 여행에 갔다. 처음부터 친구의 행복한 모습을 아주 좋아해서 인물 사진을 많이 직었다. 여행 끝난 후에 사진을 다시 보면 기분이 좋고 즐거운 추억도 암기한다. 사진을 직다가 아름다운 경치도 구경할 수 있기 때문에 지금 풍경 사진을 직게 되었다. 사진을 직을 때 준비할 것이와 주의할 점이 중요하다. 먼저 카메라나 휴대폰을 가지고 들어야 한다. 그리고 날씨가 따라서 입을 옷이도 주의해야 되다. 긴 시간 외출해서 몸에 관리도 필요하다. 일기예보 꼭 볼 만한다. 다음으로 친구를 같이 놀 때 도 카메라 잘 보관해야 한다. 간식을 먹으며 카메라을 가방에 놓어 둔다. 이렇게 하면 카메라가 잘 깨끗하게 보관고 잃어버리지 않는 것 같다. 사진 직기는 예쁜 사진을 직을 수 있며 친구를 같이 좋은 시간도 보낼수있어서 앞으로도 여가가 있을 때 게속 할 것이다. 한 달에 한 번 종도도 좋을 것 같다. 즐겁게 하다가 모에 관리와 카메라 보관하는 것도 많이 해야 된다.	B1
B100156_v01.txt_2.txt	나의 취미	제 취미가 영화하고 드라마 보기이다. 언제부터 시작하는 지 잘 모른다. 근데 스트레스 받을 때 좋아하는 영화이나 트라마 보면 기분이 좋아하질 수있다. 시간이 되면 노트북이나 핸드폰만 있으면 취미를 할 수있다. 생각보다 이취미는 저희만 특별한 취미아니다. 사람들이도 영화를 좋아한다. 왜냐하면 사람들이 한생활만 살때 좋아하지 않다. 저도 다른사람의 생활 언제나 한번 살아 보고싶다. 그리고 영화를 볼때 다른 생활살 수있는 느낌이다. 그래서 영화감상를 좋아한다. 취미 새활을 할 때 주의할 점도 있다. 시간을 많이 필요해서 걱정해야한다. 보면 계숙보고 싶다. 그래서 다른 일이 할 수 없다. 무엇이 많이 해도 안 좋다. 그래서 취미를 맞게 생활하면 할 것이다.	B1
B100331_v01.txt_1.txt	나의 취미	내 취미는 음악 감상입다. 음악 감상은 많은 상람이 좋아하는 취미입다. 나는 친한 친구가 음악을 좋아해서 음악 감상을 좋아하게 됐다. 어렸을때 나는 음악의 관심이 없었다. 하지만 종등학교에서 내 친한 친구가 매일 나에게 음악에 대한 일을 이야기해서 나는 음악을 료개한 것이 점점 많았다. 그래서 알은 음악이 많고 노래를 부른 것을 좋아했다. 고등학교에서 공부한 것이 어렵다. 그래서 스트래스는 많고 기분이 항상 나빴다. 스트래스는 풀은 방밥이 음악 듣기이다. 나는 매일 숙재를 쓰다면 음악을 들였다. 기분이 점점 좋았다. 나는 기분이 좋을 때는 활발한 음악을 듣는 것을 더 좋아하다. 한국에 온 후에 한국음악을 들었다. 음악을 듣다며 한국어를 배운 것이 좋다. 그래서 미래에 나는 음악 감상을 게속 좋아하다.	B1
B100100_v02.txt_2.txt	나의 취미	사람마다 평일에 좋아하는 일이 따라서 각각의 취미는 다르다. 저처럼 활발한사람 대해 운동하는 것인 좋다. 제 취미는 배드민터 친다. 배드민터를 치면 키가 크고 건강을 좋다. 그래서 여유시간있으면 친구와 같이 배드미터를 친디. 고등학교 때 체육수업이나 주말에 시간이 있으면 우리 학교 체육관에 배드민터를 치는다. 배드민터 치는 동안 제일 행복한 시간인다. 하지만 한국에 오는 후에 같이 배드미터를 친 친구 없는데 오랜 시간 못 친다. 취미 생활 하면서 게임, 늦게 잠, 쇼핑, 영화등 원래 주말에 하는 일을 겪을 것 같다. 하지만 건강 대해 좋아하는 일이 많이 하면 좋다. 먼저 배드미터 할 때 준비해야 일이 준비운동인다. 천천히 뛰고 배드민터를 시작하면 더 좋다. 그리고 배드민터 칠 때 주의할 점 긴 시간 운동, 안 쉽으면 안 된다. 그런데 몸에 수분 흐르며 너무 피곤하다. 마지막 스트레스 있을때 배드민터를 쳐보면 기분이 전활할 수 있다. 앞으로 여유시간이 있으면 저는 한국에 사는 배드민터 대해 조항하는 친구와 같이 배드민터를 치는다. 운동을 예전보다 만힝 하면서 집에서 태레비전을 보는 시간 늘려면 건강 대해 좋다.	B1
A200052_v01.txt_2.txt	나의 취미	제 취미는 당구를 치기 입니다. 작녁부터 좋아했습니다. 수업이 끝난후에 심심할 때 친구 하고 당구장에 가서 당구를 칩니다. 당구가 재미있습니다. 그래서 제가 당구를 좋아합니다. 주말마다 친구하고 집에서 심심하기 때문에 또 당구를 칩니다. 당구를 치면 돈하고 좋은 당구장이 필요합니다. 조금 비싸지만 재미있습니다. 요즘은 바쁘니까 가끔 당구를 칩니다. 우리집 근처 좋은 당구장이 있습니다. 그래서 방학에 많이 칠 겁니다. 당구를 치면 당구를 좋아 해야 됩니다. 친구들이 당구를 좋아하면 저에게 연락 주세요. 언제든지 또 한영합니다. 우리 같이 좋아하는 당구를 칠 겁니다.	A2
B100120_v01.txt_2.txt	나의 취미	나의 취미가 태권도를 배우는 것이다. 태권도는 한국의 전통 운동이다. 그리고 올림픽경기에서 한국 선수들이 자주 금메달을 딴다. 나는 한국 태권도 선수 이대훈때문에 태권도를 배웠다. 이대훈은 겨루기를 할때 아주 멋있어서 나의 우상이 됐다. 그후에 나는 태권도를 배우기 시작했다. 나는 고등학교 때부터 태권도를 배웠다. 처음 그냥 좋아하기는 했지만 점점 뜨겁게 사랑하게 됐다. 태권도를 통해서 몸이 튼튼해질 뿐 아니라 친구들도 많이 만들었다. 우리도장에서 친구들이 가족처럼 친한다. 대회에 참가할때 같이 연습하며 질때 같이 우는 기억을 일어버리지 못했다. 첫번째 사범님이 태권도 정신은 예로 시작하고 예로 끝났어요라고 말했다. 그리고 수업할때 도복하고 띠를 필요하다고 했다. 태권도를 배우하면 건강에 좋아질 뿐 아니라 좋은 습관도 기를 수 있다. 나도 태권도를 통해서 백절불굴의 정신을 키웠다. 다쳐도 포기하지 않는 의미를 갖은다. 태권도 덕분에 많은 것을 배웠다. 다시 태어난다면 태권도 선수가 되고 싶다. 그러므로 앞으로도 태권도를 계속 할 것이다. 나는 자주 자신에게 아무리 힘들어도 포기하지 않는다고 했다. 꿈을 이루기 위해서 지속하게 노력해야 진다. 포기하면 안 된다.	B1
B100093_v02.txt_2.txt	나의 취미	나의 취미는 조각하기이다. 나는 나무로 다양한 걱을 만드는다. 어렸을 때부터 조각하기가 재미있어 보여서 해 보고 싶었다. 그래서 2010년 여름 때 나의 첫모양의 칼 샀다. 그리고 나무로 첫 만든 모양은 두꺼비였다. 2010년부터 한국에 오기 전에까지 거의 매일 조각했었다. 조각하기 쥐미로 하려면 딱 한개 필요하다. 그것을 모양의 칼이다. 나는 모양의 칼은 여덟개쯤 있고 도끼 한개 있는데 솔직히 한개 밖에 필요 없다. 나무는 아무데도 찾을 수 있다. 숲이나 공원에서 보통 나무가 많아서 쉽게 찾을 수 있다. 그리고 조각할 때 쉽게 다칠 수도 있기 때문에 왼손에 장갑을 없으면 좋다.	B1
B100107_v02.txt_2.txt	나의 취미	나는 좋아하는 것이 춤이다. 요즘은 춤을 좋아하는 사람이 증가하고 있어서 같이 춤을 출 수 있는 사람이 많아졌다. 그래서 정말 기쁘다. 나는 8살 때 영국에 가서 발레를 배웠다. 그 동안 재즈라는 댄스 종류를 알았다. 몇번 공연을 본 후에 재즈가 정말 아름답다고 생각해서 관심이 있다. 그래서 영국에 돌아온 후에 발레를 공부하고 싶지 않고 재즈를 공부하고 싶었다. 그리고 13살부터 재즈를 연습해 오고 있다. 나는 한국에 온후에 홍대에 갈 때 댄스 공연을 보고 한 팀에 이갑했다. 지금은 다른 한국 멤버하고 같이 홍대에서 거의 공영을 하고 있다. 중국에서 공연도 했다. 하지만 한국에서 공연을 할 때 더 재미있다 관개들이 신나게 공연을 보고 같이 춤을 추는 것을 잊어버릴 수 없는다. 나는 댄스가 제일 쉬운 취미이다고 생각했다. 그 이유가 특별한 준비가 빌요없는 것이다. 변한 운동화하고 변한 옷하고 좋아하는 음악이 있으면 연습할 수 있다. 그런데 춤을 출 때 주의할 점이 3개 있다. 젓째, 준비운동을 많이 해야 된다. 둘째, 딸이 많이 날 때 숨을 많이 마시면 안된다. 셋째, 댄스를 많이 연습한 후에 전전히 걷는 것을 해야 된다. 다 할 수 있으면 더 건강하게 단스를 할 수 있다. 나는 춤을 추는 것을 정말 좋아해서 아프로 계속 친구하고 춤을 추고 공연을 신나게 할 것이다.	B1
B100166_v01.txt_1.txt	나의 취미	사람들은 취미가 있는다. 그리고 저도 취미가 있고 제가 농구를 하는것을 좋아한다. 어렸을 때 매일 친구하고 같이 놀랐다. 15년 전에 초등학교의 농구장에서 두 학생은 농구를 했다. 제가 집에 가서 아버지하고 농구를 좋아하는것을 이야기 했다. 그러니까 내 아버지께서 저에게 농구를 샀다. 저는 매일 반친구하고 농구를 했다. 2007년 저는 중구의 대학교에 입악했다. 2007년 부터 2011 까지 대학교에 다녔다. 그동안 제가 자주 농구장에 농구를 하러 갔다. 그리고 농구를 좋아하는 사람을 많이 사궜다. 주말마다 우리반 남자학생들은 농구를 했다. 한국에 오기 전에 2반 일주일에 농구를 했다. 한국에 온 후에 같이 농구를 하는친구 적으니까	B1
A200126_v02.txt_2.txt	나의 취미	저는 음악 듣기를 좋아합니다. 그래서 이건 제 취미입니다. 옛날보터 언제나 어디든지 저는 노래를 들 수 있습니다. 좋아하는 이유를 너무 많습니다. 혼자가 있을 때 노래를 항상 들 겁니다. 그래서 음악은 제 친구인 것 같습니다. 기분이 나쁠 때도 음악을 많이 도와 줍니다. 저는 기분이 나쁘면 화가 쉽게 납니다. 다른 사람은 제가 자주 무섭습니다. 그래서 그때 같은 혼자 있어야 합니다. 그때는 그냥 느리게 노래를 들으면 기분이 더 좋아합니다. 한국에서도 기숙사보터 대학교까지 길이 조금 멀어서 다닐 때 저는 걷고 노래도 듣습니다.	A2
B100132_v01.txt_2.txt	나의 취미	이 세상에서 내가 제일 좋아하는 것은 비디오 편집이다. 어렸을 때부터 비디오 편집에 대해 관심을 많이 있는데 마음에 좀 걱정했다. 그런데, 비디오 편집은 복잡하고 힘들기는 하지만 재미있는 일이 었다. 초등학교 때 아버지 때문에 텔레비전 방송국에 갔었다. 이 후 중국에서 유명한 프로그램을 밨고 유명한 사회자도 만났었다. 이 때부터 텔레비전 방송국에 전전히 관심이 시작한다. 고등학교 때 내가 우연히 한국의 버라이어 쇼를 봤었다. 그 내용은 다양하고 신기했다. 그래서, 한국 방송국에 관심이 많다. 이 후 친구가 같이 한국 버라이어 쇼를 많이 봤다. 우연히 한국의 박찬욱 감독영화를 봤다. OLD BOY, 제가 처음에 한국 영화를 본다. 이 때부터 다른 나라의 영화보다 한국 영화를 더 좋고 감정도 부드럽다. 고등학교 졸업한 후에 텔레비전 방송국에 실습했다. 실습기간에 정말 힘들는데 방송국의 사람들이 뭘 하려고 하는지 조금씩 이해하기 시작했다. 그 일이 이제도 생각하면 기분이 좋고 미소가 절로 떠오른다. 그래서 다른 사람보다 비디오 편집은 더 열심이 공부하고 영화도 많이 본다. 아무리 힘들어도 포기지 않다. 앞으로도 비디오 편집은 꼭 열심이 공부하며 다른 영화나 버라이어 쇼도 많이 보고 실습도 더 노력할 것다. 한국 대학교 졸업한 후에 중국에 돌아갈 때 유명한 영화 회사에 취직하면 좋겠다.	B1
A200128_v02.txt_2.txt	나의 취미	제 취미는 축구예요. 어렸을 때 축구를 아주 좋아했습니다. 중학생 때 고향 친구들와 같이 자주 축구를 했습니다. 축구를 한 후에 강으로 가고 놀러 갔습니다. 많이 놀러 가기 때문에 아주 피곤했습니다. 하지만 기분이 좋았어요. 고등학생 때 아버지께 저에게 축구공을 주었어요. 수업이 끝나고 우리반친구들과 축구를 헀어요. 지금 까지 기념을 기억했어요. 축구를 하려면 특별한 것이 필요하지 않아요. 축구공만 있으면 축구를 할 수 있어요. 한국에 왔을 때 그 취미 활동을 하지 못했어요. 공부하기 문에 시간이 없습니다. 한국에서 돈을 많이 쓰니까 공부해야 해요.	A2
B100027_v01.txt_2.txt	나의 취미	사람마다 자기 취미가 있다. 내 취미는 음악감상이다. 음악감상을 하면 기분이좋고 행복해서 음악감상은 나는 제일 좋아하는 것을 된다. 나는 고등학교 때 음악감상을 시작했는데 지금까지도 이 것을 매일 매일한다. 나는 항상 숙제를 하거나 운동을 할 때 음악감상을 한다. 가거운 음악을 듣면서 숙제를 하면 집중력을 올닐 수 있어서 숙제도 좋고 빨리 할 수 있다. 운동을 할 때 조금 힘들어서 항상 스트레스가 받는다. 음악을 들으면 스트레스가 부를 수 있기 때문에 운동을 할 때 너무 힘들기 않다. 그리고 매일 밤에 잠을 자기 전에 음악감상은 빨리 잠을 드는 데도 도움이 된다. 음악감상을 할 때 좋은 MP3하고 좋은 기분을 준비하면 좋을 것 같다. 하지만 음악을 많이 들으면 몸에 좋지 않기 때문에 매일 3시간정도 음악감상을 했으면 좋겠다. 지금까지 나의 취미가 소개하였다. 취미활동은 행복하고 건강하게 사는 데 도움이 되기 때문에 앞으로 나도 음악감상을 계속 한다. 여려분들도 취미활동을 시작하고 계속 했으면 좋겠다.	B1
B100165_v02.txt_2.txt	나의 취미	사람마다 취미가 있다. 나도 마찬가지다. 나의 취미는 피아노를 치는 것이다. 어렸때 부터 나 꿈이 있다. 나중에 꼭 무대에서 사람들에게 피아노를 치겠다. 그래서 지금까지도 노력하게 연습했다. 초등학교에 다닐때 피아노를 치는 것이 시작한다. 난 꿈이 이루기 위해서 매일 연습했다. 피아노를 칠 때마다 기분이 좋아졌다. 그리고 하구의 모은 스트레스를 풀 수 있다. 피아노를 치기 때문에 제일 좋아하는 선생님이 만났다. 피아노를 칠 때 청말 행복하다. 하루 중에 속에서 우울을 확 풀 수 있다. 그런데 6개월 전에 대학교에 다니기 위해서 중국에서 계시는 부모님을 떠나 한국에 오게 됐다. 한국에서 피아노를 없어서 6월동안 피아노를 못 쳤다. 마음에 정말 답답하다. 하지만 나는 이렇게 어려원 곤난 앞에 나의 취미 포기하지 않다. 피아노를 치는 것은 나의 마음이 편화에 도움이 되지만 공부해야 할 때 계속 피아노를 생각했다. 그래서 엄마는 나한테 많이 충고하셨다. 나중에 나는 꼭 추의하겠다. 그러므로 이상는 내 취미생활이다. 앞으로 꿈이 이루기 위해서 계속 피아노를 치다. 노력하게 연습하고 포기하지 않다.	B1
B100108_v02.txt_2.txt	나의 취미	오늘은 여러분에게 나는 취미를 소개합니다. 나의 취미는 수영, 그림, 음악,쇼핑, 요리하고 영화이다. 먼저 수영시작 소개합니다. 나는 초등학교 끝날때 수영장에 처음 갔다. 이일동안 수영을 배운다. 그 때부터 지금까지 해마다 여름 꼭 수영장에 갔어서 친구나 가족이 같이 수영을 했다. 얼마나 재미있다. 그래서 수영는 내가 제일 좋아한 운동이다. 수영을 할때 주의할 점이 도 중요한다. 바다에서 수영을 할 때 멀은 곳에 가지 말고 자기의안전을 보호한다. 그 밖에는 수영후에 물을 마시겠 드고 잘 쉬워면 좋은 것 같다. 그리고 고등학교 배울 때 갑자기 그림이 좋아하기 때문에 그 때부터 시작했다. 보통 그림을 그리면서 휴대본로 음악을 듣다. 그림을 그리전에 연필하고 지우개 준비해야 된다. 얼마전 까지 나도 그림을 그렸다. 또 최근 나는 자주 쇼핑을 한다. 강남이나명동에서 많이 쇼핑을 하기니까 아주 친절한다. 그 두개 쇼핑장소는 물건을 싸게 살 수 있고 교통이 편한다. 또한 한국에 오기 후에 중국음식이 먹고 싶을 때 항상 직접 요리한다. 맛있은 중국음식을 먹을 수 있고 개미있는 것 같다. 이상 나는 자주 하는 취미활동이다. 정말 개미있는 활동이다.	B1
B100089_v02.txt_2.txt	나의 취미	내 취미는 여행을 하는 것이다. 가족과 가는 것도 친구와 가는 것도 즐겁다. 나는 해마다 해외로 여행을 가는데 한국, 미국, 프랑스에 가 본 적이 있다. 한국은 일본에서 가깝고 싸게 여행할 수 있기 때문에 3번 와 봤다. 내가 처음 해외에 갔던 나라는 한국이다. 어머니와 같이 갔는데 그 때 우리는 겨울 연과에 빠져서 촬영지에 갔다. 이 처음 갔던 여행이 재미있어서 나는 여행이 좋아하게 됬다. 여행은 돈이 많이 필요해서 자주 갈수는 없지만 다양한 것을 겪을 있다. 우선 다른 나라의 문화를 알 수 있다. 그리고 일본 문화에 대해 관심이 있는 외국인들을 만날 수 있다 그런 사람들을 만나기마다 나는 자기 나라의 문화에 대해 잘 생각하게 된다. 그래서 여행할 때 경함한 것은 정말 중요하다. 취미 생활을 할 때 준비해야 할 것은 돈과 지직이라고 나는 생각한다. 돈이 없으면 여행은 할 수 없고 지직이 없으면 여행을 즐길 수 없다. 지직은 언어, 문화 등 여러 까지 있다. 이런 것들은 여행하기 전에 알아야 한다. 여행할 때 주의할 점은 이문화가 있다고 지각하는 것이다. 매너는 나라에 따라서 크게 다른다. 그래서 여행하기 전에 그 나라에 어떤 문화나 매너가 있는지 잘 찾아야 한다. 앞으로는 대학교를 졸업하기 전에 친구와 같이 홍콩에 갈 것이다. 즐거운 여행을 위해 지금부터 홍콩에 대해 언어, 문화, 매너 등을 공부할 것이다.	B1
A200065_v02.txt_2.txt	나의 취미	저는 취미는 수영을 이예요. 제가 자주 심심할 때 수영장을 갈 겁니다. 제가 그등학샌보터 수영을 잘 아랐습니다. 영 때문에 제가 수영을 알았습 도 우리 집에서 바다 군정에 있어요 그래서 주말에마다 영 데리고 같이 갔습니다. 저는 형 때문에 수영을 좋아합니다. 그래서 안경이나 수영 옷을 필요합니다. 저는 한국에 왔서 수영장을 가끔 갔다왔습니다. 왜나하면 시간이 없기때문에 갈 수 없어요. 저는 이번 방학에 친구하고 수영장에 가야 돼요.	A2
