B100158_v01.txt_2.txt	나의 취미	내 취미는 여행이다. 우리 가족도 여행을 좋아해서 내가 아이 때부터 다양한 나라나 장소에 가족과 여행을 했다. 그 여행은 모두 재미있어서 여행을 좋아해서 내 취미에 된다. 여행은 호텔예약이나 비행기표 예매 등 이 필요해서 준비하는 시간이나 일이 조금 많다. 하지만 준비할 때 재미있는 여행을 생각하고 신나게 준비 할 수 있다. 여행은 재미있지만 돈이 많이 필요한고 여행지에서 사고 등 주의 해야 한다. 여행지에서 맛있는 음식을 먹고 쇼핑도하고 싶은데 돈이 필요하다 여행에 가기 위해서 일을한다. 여행은 내 취미며 내 스트레스 해소방법이다. 나는 여행을 하고 사진을 찍은 것이 좋다. 추억도 많고 사진을 보면 또 여행을 가고 싶은데 오늘도 열히미 한다고 생각한다. 내가 좋아하는 여행지는 태국이다. 바다는 아름다워서 사람도 친절하며 음식도 맛있다. 태국는 가 볼 만한 곳이다. 나는 앞으로 이탈리아에 가고싶다. 여행은 아시아나 일본이 많아서 다른 먼나라에 가고 싶다.	B1
A200116_v02.txt_2.txt	나의 취미	제 취미 사진을 찍는 것 입니다. 고등하교 다닐 때부터 그 취미 시작했지만 나쁜 사진기만 있습니다. 그 것 때문에 제가 아르바이트를 찾아야 됬습니다. 왜내하면 제가 좋은 하고 비싼 사진기 사고 싶었어요. 하지만 아르바이트를 월급을 적습니다. 그리고 우리 어머니께 말해서 대학교 입학하면 사진기를 성물했습니다. 그런데 나는 옐심히 공부해서 모두 시험을 찰 봤습니다. 이 취미 진짜 재미있는 것때문에 나는 이취미를 좋아합니다. 한국에서 이 취미 못 했습니다. 왜내하면 제 사진기가 러시아에서 잊어버렸습니다. 제가 사람 얼굴 찍는 걸 좋아요.	A2
B100103_v02.txt_2.txt	나의 취미	저는 취미 바로 수영인다. 총등학교때부테 수영을 시작한다. 지금에까지 6년 동안 수영하게 된다. 나는 취미 생활 겅간에서 좋는다. 그레서 엄마가 나하고 자주 수영 한다. 시간이 나오자마자 수영장에 간다. 나쁜 일이 생겼때마다 수영도 한다. 자주 수영하면 몸이 좋고 얼굴도 좋는다. 수영을 하면서 얼만아 나쁜 일이 다 잊어버리게 된다. 총등학교때 친구들하고 수영하기 전에 준비운동하는데 친구가 준비운동을 못 한다. 직접 수영했어서 달리가 수영장안에 물이 따뜻하게 때문에 못 활동했는다. 그때는 우리 친구들이 다 깜짝놀았어서 문법어떻게 도와주는 방법도 생각이 안는다. 앞에 수영 잘 한 사람이 덕분에 친구가 도와준다. 그 후에는 수영하기전에 꼭 준비운동 한다. 수영한때 많이 위험있지만 우리가 아이인 때문에 깊는 물안에 가지마란다. 수영할때 꼭 수영안경 있는다. 없으면 너무 위험한다. 수영을 공부하고 싶어면 수영 잘한 사람이한테 물어봔다. 도우미게 될 수 있는다. 수영을 취미있지만 그런데 나는 앞으로 더 계속 수영한다. 매주마다 수영장 꼭 한번게 간다. 그레서 어떻게 수영을 읽어버리지 안않는다. 친구들한테 수영을 겅간에게 얼마나 좋은지 소개하게 됀다. 앞으로 우리 열심히 수영한다.	B1
B100328_v01.txt_2.txt	나의 취미	내 취미가 기타를 치는것을이다. 어렸을때부터 기타를 듣는 것이 좋아하는데 밤에마다 기타를 들었다. 들을 때 기분이 좋다. 대학생때 배운 기타를 시작했다. 지금까지 배운지 10년 됐다. 처음 배울 때 너무 어렵지만 많이 연습해서 잘 칠수있다고 생각한다. 좋아한노래를 친지 알면 좋겠다. 주말마다 친구들이 같이 만나서 밥을 먹고 기타를 친다. 하지만 요즘에 공부가 많아서 못 쳤다. 슬프할 때 기타를 치면 슬프가 풀 수 있다. 경희대학교에 기타동아리가 유명해서 다음주 시험을 끝난 후에 동아리에 입장하야 된다. 앞으로 같은취미사람이 만나면 좋다고 한다. 그리고 기타를 계속 연습한다.	B1
A200127_v02.txt_2.txt	나의 취미	제 취미는 수영입니다. 저는 고등학생을 수영을 시작했습니다. 고등학교에서 수영을 배워서 좋아합니다. 태국에서 더우기 때문에 수영을 좋아합니다. 저는 심심할 때 자주 수영했습니다. 집에서 언니와 함께 수영했습니다. 친구 없으면 혼자 해서 괜찮습니다. 수영을 하고 싶으면 수영복만 필요합니다. 하지만 저는 수영복을 입어 못 했어요. 지금은 저는 한국에 있어서 우영을 못 했습니다. 수영장에 사람이 많기 때문에 못 했습니다. 한국에서 제 취미는 음악 감상입니다. 지금은 한국어를 공부하고 있습니다. 그래서 한국어를 공부해야 해요. 저는 한국 노래를 좋아합니다. 그리고 한국 가수도 좋아합니다. 한국 가수를 목소리가 아주 좋아합니다. 한국 노래도 의미가 좋아합니다. 하지만 지금도 수영을 하고 싶습니다. 태국에 돌아가면 먼저 수영을 할 거예요.	A2
A200056_v01.txt_2.txt	나의 취미	저는 피아노를 치는 것에 관심이 있습니다. 피아노를 치고 싶어서배웠습니다. 20년전 부터 시작했습니다. 저는 음악을 좋아하기 때문에 피아노를 배웠습니다. 피아노를 칠때 기분이 좋습니다. 제 집에 피아노가 없어서 친구집에 가면 연수를 할 수 있습니다. 연수는 매일해야합니다. 저는 매일 연수를 했습니다. 한교에서 장기자랑대회에 참가했습니다. 피아노를 치고 싶으면 잘하고 싶은 마음이 필요합니다. 한국에서 피아노를 칠 수 없습니다. 음악을 들을때 피아노를 치고 싶습니다. 일본에 돌라가서 칠 겁니다. 피아노를 치는 활동이 있으면 참가하고 싶습니다. 일본에 돌라가기 전에 한번 한국에서도 치고 싶습니다.	A2
A200130_v02.txt_2.txt	나의 취미	취미는 클레식음악 듣기와 야구에요. 글레식음악은 공동학생보터 지금까지예요. 야구는 유치원부터 지금가지예요. 클레식음악을 들 때 기분이 리라커스할 수 있으니까 좋아요. 야구는 하는 것을 기분이 좋아는데 좋아요. 야구은 하려면 글러브가 필요해요. 글레식음 들기는 컴퓨터가 없기 때문에 컴퓨터가 필요해요. 한국에서도 취미는 활동을 하고 있어요. 저는 야구가 좋아서 경희대학교 야구 동아리예  참가해요. 그래서 매주 수요일 운동정에서 선배하고 후백 같이 연습해요. 클레식음악 들기는 활동을 없으니까 가튼 취미 사람은 찾아고 해야 돼요.	A2
A200059_v02.txt_2.txt	나의 취미	저는 여행하는 것을 좋아합니다. 이 취미는 제가 대학샌부터 시작했습니다. 대학샌때 휴가가 많이 있었어 친구하고 여행을 많이 했습니다. 여행을 할 때 새로 것이 구경하거나 쇼핑하면 재미있고 기분이 좋아습니다. 그리고 외국에 가면 외국사람하고 같이 이야기하거나 다른 나라의 음식을 먹은 것도 좋십니다. 여행 할 때 돈이 많이 필려하기 때문에 일을 열심 해야 됩니다. 그리고 여행 할 때 시간도 필려해서 일 하면 조금 어렵습니다. 그래서 극제 여행 안이고 극내 여행도 좋습니다. 한국에서도 제주도에 두번 부산에 한번 가봤습니다. 제가 한국에서 져일 제주도가 좋아합니다. 공기이나 음식과 좋었습니다. 저는 지금 시간이 많이 있는데 여행을 하고 싶습니다. 한국에서도 다른 도시에 많이 가고 싶습니다.	A2
B100162_v01.txt_2.txt	나의 취미	나는 좋아하는 일이 많다. 도서,영화감상,여행,음악 감상등 나도 좋아한다. 그 중에서 나 제일 좋아하는 일은 여행이다. 나의 취미는 여행이다. 아마 초등 학교 때부터, 매년 여름, 겨울에는 학교에 갈 수 없고 엄마가 시간 있으면 우리도 같이 다른 도시에 여행 했다. 도시에 따라서 문화, 음식슴관등 도 많이 변화한다. 이렇게 변화기관해서 나 많이 관심하다. 그래서, 지금까지 나도 여행을 좋아한다. 나 처음 부모님이 없는 여행을 18세 여름을 했다. 나는 오빠 같이 중국의 남복에서 사람이 많지 않기는 하지만 풍경이 너무 너무 아름다운 작은 도시에 갔다. 그 곳은 많이 자동차도 없기 때문에 신선한 공기가 있다. 나무가 많고 이름이 모라는 동식물도 많다, 도시에 비해서 너무 시원하다. 스트레스를 많이 있는데 그 곳에 가면 스트래스를 다 푸는다. 여행을 재미있기는 하지만 여행 전에 많이 준비를 필요한다. 약, 따뜻한 옷, 돈, 운동화등 도 많이 필요한다. 해외여행 하면 여권,지도등등 도 여행을 시작 전에 준비하야 된다. 건강이 여행중에서 제일 중요하는 일이다. 앞으로 나의계획은 매년에 네개 여행지나 갈 것이다. 많이 다얀한 문화를 보고 비슷하지 않는 맛있는 음식을 먹을 것이다.	B1
B100065_v03.txt_1.txt	나의 취미	나의 취미는 여행 하기 하고 뮤지컬 괌상이다. 여행은 고등학교 때 부터 좋아하고,아른다운 경치를 봐서 너무 감동해서 자주 여행을 가게 됐다. 뮤지컬은 요즘 보러 가게 됐다. 여행을 갈때는 항상 주말이나 휴가를 이용해서 간다. 같이 가는 친구 하고 계획하는 것도 재미있다. 여기저기 가고 맛있는 음식을 먹고, 아른다운 경치를 보면 스트래스가 프는다. 그리고 사진을 많이 찍는 것도 너무 좋아하다. 여행 후에 찍은 사진을 보면 즐거운 시간을 기억이 낸다. 하지만 여행은 돈이 많이 필요한다. 시간도 많이 필요한다. 매주 여행을 갈 수 없다. 뮤지컬도 표가 너무 비싸서 자주 보러 갈 수 없다. 나의 취미는 돈이 많이 필요한다. 여행에 통해서 알게 된 친구가 많이 있다. 그 친구들도 여행이 좋아해서 같은 취미를 가지고 있는 사람들 하고 이야기하고나 같이 여행을 가는 것은 너무 재미있다. 뮤지컬도 그것을 좋아하는 친구 하고 보러 가서 뮤치컬을 끝 후에 그 이야기하는 것이 재미있다. 나의 취미는 혼자 보다 친구하고 같이 즐기면 더 즐길 수 있는 취미이다.	B1
B100098_v02.txt_2.txt	나의 취미	경치가 아름답고 공기가 좋은 곳 가는 것을 나 취미이다. 나는 친구함께 다른 나라 영행 가는 것을 아주 좋아하는다. 영행을 하면 스트레스를 풀 수있고 새론 친구도 만날 수 있다. 그 도안 공부할 때 어러운 일이나 회사에서 꾸미가 귀게 잊어버릴 수있고 기분이 즐거워질 것이다. 영행에 갈 때 나는 항상 많이 준비해야 한다. 먼저 가는 곳 유명한 장소 이름 그 날씨가 어때, 한국부데 거기까지 비형기로 얼마나 걸린거 호텔을 예약 했다. 이테네으로 찾아해야 한다. 그 취미 생활을 할 때 주의할 점도 중요한다. 거기가면 뭘 문활을 알아하야 하다. 그리고 약도 준비해야 하며 영어도 간단하게 이야기하면 좋겠다. 다는 항상 친구하고 년마다 다른 나라에 가는다. 하지만 지금 한국에서 유학기 때문에 영행을 못 가는다. 지금 주말마다 친구하고 서울 근처에 영행 할 것이다. 앞으로도 그 취미는 계속할 것이다.	B1
A200046_v02.txt_2.txt	나의 취미	저는 취미가 많이 있습니다. 그중에서 독서하고 음악 감상하는 것을 좋아합니다. 그래서 책하고 음악에 관심이 있습니다. 고등학교부터 그 취미 활동을 시작했습니다. 먼저 독서 취미는 이야기할 거예요. 독서하는 것이 유익합니다. 책을 읽으면 지식을 넓힐 수 있습니다. 특히 학생들에게 독서가 필요합니다. 책을 읽을 때 책이 많이 필요합니다. 저는 소설을 읽는 것을 좋아합니다. 책을 읽으면 매일 책을 읽어야 됩니다. 책을 읽는 참 유익합니다. 그리고 음악 감당도 재미있습니다. 음악을 때 CD가 많이 필요합니다. 저는 심심할 때 음악 감상 자주 들습니다. 그 때 편해서 모두 잊어버릴 수 있습니다. 아주 좋습니다. 취미가 참 도와 주기 때문에 한국에서도 활동을 하고 있습니다.	A2
B100159_v02.txt_2.txt	나의 취미	나의 취미가 노래를 부른다. 어렸을 때 어머님을 나에게 자주 노래를 불렀다. 어머님께서는 나에게 자주 가르쳤다. 내가 노래를 좋아해게 된다. 중국에서 대학교에 간 후에 친구하고 같이 자주 노래방에 갔다. 그래서 나의 취미가 같은 친구를 많다. 노래를 부르며 춤을 추는 것을 좋아하기 때문에 대학교 1학년 때 교내 학생회의 문예부에 가입했었다. 그리고 1년 후에 학원 학생회에 가서 승진했다. 내가 문예부의 부장이 됐다. 내가 대학교 3학년 때 선생님이 나를 신임하셔서 교내 가수 대회의 총핵임자를 맡으라고 해셨다. 그리고 활동은 원만하게 끝났다. 음악이 나를 성장시켰다. 나는 자주 음악을 듣는다. 노래를 잘 불러서 많은 친구를 사귀게 됐다. 평소 우리는 시간이 있으면 노래방에 같이 갔다. 중국에서 살 때 교내 가수 대회에 참가했었다. 스트레스가 많을 때 친구와 같이 노래방에 갈 만했다. 노래를 부르면 부담을 덜수 있다. 노래를 부른 후에 스트레스를 푼다. 초조 등이 모두 없어진다. 이번 주말에 토픽시험이 있어서 나의 스트레스를 많이 생겼다. 하지만 지금 집에서 자주 노래를 부르면 스트레스를 좀 작다.	B1
B100126_v01.txt_2.txt	나의 취미	나의 취미는 독서이다. 특별한 취미는 아니지만 나 한테 정말 중요한다. 그리고 취미 활동을 할 때 즐겁다. 독서 때문에 친구도 많이 만났다. 아주 도움이 된 일이다. 초등학교 때 책을 읽는 것이 싫어한다. 너무 심심한 일이 생각한다. 그런데 중학교 때 친구 집에 갈 때 너무 좋고 재미있게 읽을 수 있는 책을 봤다. 그때부터 독서를 좋아한다. 책을 읽는 데 시간이 많이 걸려서 친구랑 같이 놀지 않다. 자주 운동도 않 하고 쇼핑도 않 한다. 그런데 다른 재미있는 일이 표기해야 하는데 도 즐겁다. 취미 생활을 할 때 준비할 것이 많지 않다. 그냥 마음에 든 책을 필요한다. 그리고 맛있는 커피도 필요한다. 가끔 시간이 있으면 밖에 나가서 초에서 앉아서 책을 읽은다. 또한 세상에 많이 좋은 책을 있지만 잘 모르는 것을 도 있다. 그리고 유명하게 않는 좋은 책을도 있다. 그래서 독서 동호회 홈페이지에 자주 이야기한다. 자주 추천한다. 취미 생활할 때 특별한 주의 할 점은 없다. 그냥 내용도 심심하고 글씨도 나쁜 책을 절때로 않 읽어야 한다. 아마 나쁜 영향을 줄 것이다. 앞으로도 계속 좋아하고 즐겁다. 그리고 책을 통해서 많이 지식을 배워야 한다.	B1
B100005_v02.txt_2.txt	나의 취미	어렸을 때 나는 부모님과 구경을 하는 좋아했다. 달에마다 부모님께서 나와 태국에 항상 다른 장소를 구경하셨다. 내 고향은 살던 태국북쪽아서 태국북쪽은 태국남쪽보다 구경을 하러 갔다. 태국북쪽에 유명한 장소는 치앙마이이다. 치앙마이는 자연이 아름답고 사람들은 착하다. 매년 날싸가 시원하면서 여기 꽃들은 가장 아름다워서 매년 이 축제를 온다. 이 축제는 이름이 로얄 파크 라샵픅죽제이다. 로얄 프크 랴샵픅에 갈 때 준비해야 할 것은 돈과 카메라와 물을 있다. 면저 여행을 가면 인터넷으로 장소를 찾고 가고 싶다. 내 앞으로의 계획은 디시 태국에 로얄 파크 랴샵픅축제를 가고 싶다. 그리고 태국북쪽에 항상 유명한 장소이다.	B1
B100341_v01.txt_1.txt	나의 취미	나의 취미는 영어 노래를 들기하고 요리를 먼들기이다. 종국에서 영어를 아주 종용해서 아이보터 영어를 배운 가다. 영어 잘해다면 세게적으로 친구가 사귀게 돼다. 나 17살 전에 영어를 싫어하다. 찹지기 나 영어 노래를 좋아하다. 영어 노래통해서 나 영어 좋아지다. 매일 밤에 컴퓨터로 영어 노래를 들어다. 하지만, 까끔 나 노래를 들으며 공부하니까 집종니를 없었다. 그래서, 아버지는 자주 이야기했다. 나도 요리를 좋아하다. 특변한 종국 음식을 정말 만들다. 한국 온지 와서 나 이주일에 3번 요리를 하다. 친구하고 같이 요리를 만들 후에 음식을 먹다. 요리에 통해서 많이 친구 사귀다. 공생기 한지만 너무 재미있다. 나 요리를 자주 해서 방을 조금 안 끗끗하다. 그래서 집방일 많이 있다. 나 종국 음식하고한국 음식 도 만들다. 이 반학은 나 보머님에게 요리를 할 거야. 부머님은 좋아 하보여.	B1
B100086_v02.txt_2.txt	나의 취미	내가 좋아하는 취미 많이 이다. 노래, 등산, 춤, 그림, 수영, 여행, 농구, 축구, 피아노등 하지만 제일 좋아하는 취미가 등산이다. 여렸을 때 우리 할아버지 한 달아다. 등산을 간다. 겅강하기 위해서 지금까지 꼐속 등산을 간다. 우리 할아버지과 같이 등산을 간다. 첫일 때 아주 신기하다. 힘들지만 아주 즐거웁다. 겨울에는 등산옷 하고 등산화를 필열하다. 등산전에는 나 운동을 좋지 않아다. 등산 후에는 나 운동을 하게 되었다. 등산 중에 구경을 보며 과자를 먹다. 얼마나 즐거웁다. 지금은 내가 한국에 6개월 온기 됬다. 지난 학기때 우리 반 친구하고 선생님 같이 선라산에 갔다. 친구들 같이 등산활동, 노래를 불으며 이야기 하다. 아무도 피곤하지 않다. 등산 피곤하때 우리 같이 라면을 먹다. 진짜 좋아하다. 고향에 갈려면 할아버지와 같이 또 등산을 하다. 헌재인 일이 바빠서 운동 시간이 없다. 그래서 건강하지 않다. 내가 중요일이 밖에 없다. 친구와 같이 등산을 하다. 산아내 경치는 아추 좋다. 나무도 만힝 이다. 나의 취미는 등산이다. 앞으로 계속 등산을 가다. 건강하기 위해서 여러분 우리 같이 운동하다.	B1
B100130_v01.txt_2.txt	나의 취미	나는 어렸을 때부터 여행을 좋아한다. 시간이 있으면 자주 경치가 아름다운 곳에 여행을 간다. 내가 여행을 좋아하는 이유는 많다. 여행할 때 볼거리하고 먹거리를 많으며 배울 수 있는 것도 많기 때문에 여행에게 관심이 점점 많아졌다. 또한 내가 어렸을 때 책을 많이 읽어서 가고 싶은 도시며 나라를 많다. 그래서 여행을 시작하게 되었다. 작년에 친구하고 같이 중국 상해에 가 봤다. 유명한 관광지도 가고 맛있는 음식도 먹었다. 제일 특별한 추억은 예쁜 극장에 가서 재미있는 연극을 보고 야식으로 맛있는 샤부샤부를 먹는 것이다. 먹으며 본 역국에 대해 즐겹게 이야기 했다. 그 후에 호텔에 돌아가서 아주 신나서 새벽까지 계속 이야기했다. 힘들지만 너무 행복해서 정말 좋은 추어다. 시간이 많이 지내도 잊어버리지 않는다. 여행을 가고 싶으면 가벼운 짐을 가지고 돈도 준비하 되면 된다. 특히 긍정적이 정신이 있으면 더 좋겠다. 모르는 도시에 가면 꼭 자기를 보호하야 한다. 위험한 곳에 안 가고 가족들과 계속 연락해야 된다. 밤에 늦게 나가지 않도 중요한 것이다. 나는 여행을 지속하게 좋아할 것이다. 대학생 된 후에 방학마다 꼭 한 곳에 여행을 갈 것이다. 앞으로 기회가 있으면 해외여행도 갈 것이다. 이 꿈을 꼭 이루겠다.	B1
B100336_v01.txt_1.txt	나의 취미	네 취미는 기타를 쳐는 것을 좋아한다. 어렸을 때 부터 기티를 배웠다. 지금은 기타를 배운지 10년 지났다. 스트레슬 때 기타를 쳐면 스트레스를 볼다. 그리고 시간 하고둔을 피려 있다. 나 하고 친구 주만마다 기타를 연습한다. 하지만 요즘에 한국어 배우기 때문에 기타를 못한다. 기타는 어렵지만 재미있다. 다음 방학에 기티 그라프 가려고 하다.	B1
B100142_v01.txt_2.txt	나의 취미	채 취미가 수영하기이다. 용즘 수영하는 사람을 늘 것 같다. 그리고 아기와 노인도 많이 간다. 수영할 때 규칙적으면 건강에 좋고 기분이도 좋아졌다. 재 수영하기 시작하게 된 이유는 재 어렸을 때부터이다. 어렸을 때 형과 친구들이 많이 수영장에 수영하러 갔다. 형하고 친구들이 같이 있으면 기분 너부 좋아졌다. 그 느낌을 좋아하니까 그리고 수영할 때 많이 연습하면 힘ㅇ 마음에 간해졌다. 많이 수영하기 좋기는 하지만 수영전에 준비 운동은 꼭 해야 한다. 준비 운동을 하지 못은 사람이 사고도 쉽게 난다. 이것 너무 중요이다. 특히는 많은 사람들이 있을 때 더 조심하면 좋다. 재 조등학교 때단니 매일 수업시간 끝난 후에 친구들과 수영장에 많이 연습했을 것 같다. 꿈이 있기 때문에 수영순수처럼 경기가 자주 참가하고 싶다고 생각한다. 그렇데 시간이 많이 지내면 마음에 힘들고 몸이도 힘들어졌다. 포기하고 싶을 때 매일 여아버지에게 선공하고 싶으면 꼭 항상 꾸준히 연습하고 포기하 지 말세요하셨다. 그 이야기는 지금까지 아직 마음에 있다. 아무것도 없으면 꼭 많이 수영할 겁다. 건강에 좋고 마음에 종며 건해졌다.	B1
B100009_v02.txt_2.txt	나의 취미	취미는 시간이 있을 때 하는 일이다. 취미 활동은 여러 가지 있는데 내 취미는 음악과 드라마 감상이다. 날마다 걸으며 음악을 듣고 학교에 간다. 그리고 숙제나 시험은 없을때 드라마를 본다. 음악을 듣는 것을 어렸을때부터 좋아했는데 특히 한국 음악은 중학교 때 좋아하졌다. 중학교때 한국 음악을 좋아하는 친구 덕분에 한국 음악과 드라마를 좋아하졌다. 취미 생활을 하면서 한국에 대해 것을 알게 된다. 지금도 한국 유학하는 이유는 한국 음악과 드라마를 좋아하기 때문이다. 음악 감상은 자주 간단한 취미 활동이다. 음악 듣는 것은 언제나 어디서나 할 수 있는 취미 활동이다. 입력불가별한 미리 준비해야 할 것을 없고 휴대폰만 있어도 음악을 들을 수 있다. 그러나 지하철이나 버스를 타고 가거나 많을 사람들이 있는 장소 있을 때 헤드폰을 사용하면 더 좋겠다. 시끄럽지 않게 들을 수 있기 때문이다. 드라마 보는 것도 그렇게 한다. 예전에 드라마를 텔레비전에서만 볼수 있지만 요즘 휴대폰에서 인터넷으로 볼 수 있다. 스트레스를 푸는 데는 음악과 드라마 감상을 도움이 된다. 그래서 음악과 감상을 건강에 좋다. 그런데 오래 시간동안 계속 음악을 듣거나 드라마를 보면 귀병이 생긴 겨우도 있어서 주심해야 한다. 마지막은 지금처럼 앞으로도 주심하게 음악 듣는 것과 드라마 보는 것을 꾸준히 하겠다.	B1
B100293_v01.txt_2.txt	나의 취미	나의 취미는 팬크러브 활동이다. 요즘 한국에 인기가 많은 가수가 많이 있다. 그래서 제가 한국가수의 팬크러브 활동이 자주 간다. 제가 좋아하는 가수가 비스트이다. 제가 컴퓨터에서 비스트가 처음에 봤는데 정말 멋있어서 2009년부터 계속 좋아한다. 비스트가 중국에서 활동이 많이 없으니까 제가 한국에서 왔는다. 지난 주말에 비스트의 4기 팬미팅을 했는다. 제가 친구하고 같이 갔는다. 요즘 시험 때문에 스트레스 많이 받는다. 그래서 팬미팅에 갔어서 스트레스를 풀 수 있다. 팬미팅을 시작할때 나랑 친구가 정말 긴장한다. 한국에서 팬미팅을 처음에 잔가해서 빌요하는 것을 많이 준비를 못했는다. 다른 사람이 하이힐을 신고 따뜻한 옷을 많이 입는다. 그래서 다른사람을 춥지 않고 비스트가 볼 수 있다. 팬미팅장에서 사람이 많은다. 그래서 팬미팅장에서 뛰면 안된다. 팬미팅에 본후에 나랑 친구가 기분이	B1
